filename	title	author	reader	mode	text	wordindex	sentindex	chunkindex
00010444.txt	Now in November	Josephine Winslow Johnson	Turbo3	prediction	The family's financial struggles worsen, leading to desperation and a search for alternative solutions. The narrator takes on more responsibilities and tries to find ways to alleviate their mother's pain.	45703	2246	45
00010444.txt	Now in November	Josephine Winslow Johnson	Turbo3	summary	The narrator reflects on their family's financial struggles and the conversation with the assessor about property taxes, feeling a mix of frustration and worry.	46712	2313	45
00010444.txt	Now in November	Josephine Winslow Johnson	Turbo3	prediction	The family faces ongoing financial hardships and considers selling more livestock to pay the property taxes. The father's worry and frustration continue to grow, causing him to lose his sense of self-assurance.	46712	2313	46
00010444.txt	Now in November	Josephine Winslow Johnson	Turbo3	summary	The narrator's mother dies, leaving the family in a state of grief and despair. They reflect on the loss and the emptiness they feel, as well as the financial struggles they continue to face.	47728	2379	46
00010444.txt	Now in November	Josephine Winslow Johnson	Turbo3	prediction	The family copes with their mother's death and the ongoing struggles they face, finding solace in moments of surrender and beauty amidst the weight of their circumstances.	47728	2379	47
00010444.txt	Now in November	Josephine Winslow Johnson	Turbo3	summary	The narrator visits the Rathmans and observes the deteriorating health of Old Rathman. They reflect on the past and the memories of their childhood.	48671	2435	47
